{
  "schema_version": 1,
  "engine_id": "llamacpp",
  "groups": [
    "parallelism",
    "memory",
    "batching",
    "caching",
    "speculative",
    "compilation",
    "model",
    "sampling",
    "server"
  ],
  "params": {
    "model": {
      "group": "model",
      "impact": "low"
    },
    "ctx-size": {
      "group": "memory",
      "impact": "high",
      "featured": true
    },
    "n-gpu-layers": {
      "group": "memory",
      "impact": "high",
      "notes": "The single most common reason two llama.cpp numbers disagree. Always record the value you passed and the offload the server logged.",
      "featured": true
    },
    "threads": {
      "group": "memory",
      "impact": "medium",
      "featured": true
    },
    "threads-batch": {
      "group": "memory",
      "impact": "medium"
    },
    "batch-size": {
      "group": "batching",
      "impact": "high",
      "featured": true
    },
    "ubatch-size": {
      "group": "batching",
      "impact": "high",
      "notes": "The physical micro-batch is what changes prefill throughput; batch-size alone is only the logical cap.",
      "featured": true
    },
    "parallel": {
      "group": "batching",
      "impact": "high",
      "featured": true
    },
    "cont-batching": {
      "group": "batching",
      "impact": "high"
    },
    "no-cont-batching": {
      "group": "batching",
      "impact": "high"
    },
    "flash-attn": {
      "group": "compilation",
      "impact": "high",
      "featured": true
    },
    "cache-type-k": {
      "group": "caching",
      "impact": "high",
      "featured": true
    },
    "cache-type-v": {
      "group": "caching",
      "impact": "high",
      "notes": "Quantized V cache needs flash attention; without it the server silently keeps f16.",
      "featured": true
    },
    "kv-unified": {
      "group": "caching",
      "impact": "medium"
    },
    "swa-full": {
      "group": "caching",
      "impact": "medium"
    },
    "defrag-thold": {
      "group": "caching",
      "impact": "low"
    },
    "no-mmap": {
      "group": "memory",
      "impact": "medium"
    },
    "mlock": {
      "group": "memory",
      "impact": "medium"
    },
    "split-mode": {
      "group": "parallelism",
      "impact": "high",
      "featured": true
    },
    "tensor-split": {
      "group": "parallelism",
      "impact": "high"
    },
    "main-gpu": {
      "group": "parallelism",
      "impact": "medium"
    },
    "device": {
      "group": "parallelism",
      "impact": "medium"
    },
    "rope-scaling": {
      "group": "model",
      "impact": "high"
    },
    "rope-freq-base": {
      "group": "model",
      "impact": "high"
    },
    "rope-freq-scale": {
      "group": "model",
      "impact": "high"
    },
    "yarn-orig-ctx": {
      "group": "model",
      "impact": "medium"
    },
    "n-predict": {
      "group": "sampling",
      "impact": "medium"
    },
    "keep": {
      "group": "sampling",
      "impact": "low"
    },
    "temp": {
      "group": "sampling",
      "impact": "medium"
    },
    "top-k": {
      "group": "sampling",
      "impact": "low"
    },
    "top-p": {
      "group": "sampling",
      "impact": "low"
    },
    "min-p": {
      "group": "sampling",
      "impact": "low"
    },
    "repeat-penalty": {
      "group": "sampling",
      "impact": "low"
    },
    "seed": {
      "group": "sampling",
      "impact": "medium"
    },
    "jinja": {
      "group": "model",
      "impact": "medium"
    },
    "chat-template": {
      "group": "model",
      "impact": "medium"
    },
    "reasoning-format": {
      "group": "model",
      "impact": "low"
    },
    "draft-max": {
      "group": "speculative",
      "impact": "high"
    },
    "draft-min": {
      "group": "speculative",
      "impact": "medium"
    },
    "model-draft": {
      "group": "speculative",
      "impact": "high"
    },
    "gpu-layers-draft": {
      "group": "speculative",
      "impact": "medium"
    },
    "numa": {
      "group": "memory",
      "impact": "medium"
    },
    "host": {
      "group": "server",
      "impact": "low"
    },
    "port": {
      "group": "server",
      "impact": "low"
    },
    "api-key": {
      "group": "server",
      "impact": "low"
    },
    "alias": {
      "group": "server",
      "impact": "low"
    },
    "threads-http": {
      "group": "server",
      "impact": "low"
    },
    "metrics": {
      "group": "server",
      "impact": "low"
    },
    "slots": {
      "group": "server",
      "impact": "low"
    },
    "no-webui": {
      "group": "server",
      "impact": "low"
    }
  }
}
